{"type":"config","name":"Optimize Protein VAE ensemble generator","metricName":"combined_score","metricUnit":"","bestDirection":"lower"}
{"run":1,"commit":"db783de","metric":9.17,"metrics":{"val_recon_mse":9.18,"val_diversity":3.48,"final_val_loss":0.49,"elapsed_s":0.6},"status":"discard","description":"Baseline: PerResidueVAE, latent_dim=8, hidden_dim=64, lr=1e-3, beta=0.1, 50 epochs","timestamp":1780838488450,"segment":0,"confidence":null}
{"run":2,"commit":"5bbfb42","metric":7.26,"metrics":{"val_recon_mse":7.26,"val_diversity":3.32,"final_val_loss":0.53,"elapsed_s":0.57},"status":"keep","description":"Bigger model: latent_dim=16, hidden_dim=128 (vs 8/64 baseline)","timestamp":1780838499932,"segment":0,"confidence":null,"asi":{"hypothesis":"More model capacity (latent_dim=16, hidden_dim=128) improves reconstruction on held-out proteins","val_recon_mse_improvement":-20.9,"diversity_change":-4.6}}
{"run":3,"commit":"9df15d2","metric":4.71,"metrics":{"val_recon_mse":4.71,"val_diversity":2.64,"final_val_loss":0.31,"elapsed_s":0.73},"status":"keep","description":"Lower lr=5e-4, beta=0.05, 80 epochs - better reconstruction","timestamp":1780838507619,"segment":0,"confidence":2.3350785340314135,"asi":{"hypothesis":"Lower learning rate + lower KL weight + more epochs improves reconstruction quality on held-out proteins"}}
{"run":4,"commit":"9df15d2","metric":7.58,"metrics":{"val_recon_mse":7.58,"val_diversity":3.14,"final_val_loss":0.45,"elapsed_s":0.74},"status":"discard","description":"KL annealing beta=0→0.1 over 30 epochs - worse than fixed beta=0.05","timestamp":1780838531658,"segment":0,"confidence":4.670157068062827,"asi":{"hypothesis":"KL annealing should help VAE use latent space","result":"Worse - KL even at beta=0.1 too strong","next_action":"Try even lower beta (0.01) or no annealing"}}
{"run":5,"commit":"a41615c","metric":2.09,"metrics":{"val_recon_mse":2.09,"val_diversity":1.74,"final_val_loss":0.14,"elapsed_s":0.86},"status":"keep","description":"Very low beta=0.01, 100 epochs - massive reconstruction improvement","timestamp":1780838538997,"segment":0,"confidence":3.706806282722513,"asi":{"hypothesis":"Very low KL weight (beta=0.01) allows model to focus on reconstruction","recon_improvement_percent":-55.7,"diversity_change_percent":-34.1}}
{"run":6,"commit":"7047ac9","metric":0.7,"metrics":{"val_recon_mse":0.7,"val_diversity":0.82,"final_val_loss":0.035,"elapsed_s":0.96},"status":"keep","description":"Very low beta=0.001, 120 epochs - approaching AE reconstruction quality","timestamp":1780838549765,"segment":0,"confidence":3.543933054393305,"asi":{"hypothesis":"Near-zero KL weight lets model focus entirely on reconstruction","recon_improvement_percent":-66.7,"diversity_change_percent":-52.9}}
{"run":7,"commit":"1c269b9","metric":0.56,"metrics":{"val_recon_mse":0.56,"val_diversity":0.8,"final_val_loss":0.034,"elapsed_s":1.11},"status":"keep","description":"Denoising VAE: noise_std=0.05, beta=0.001, 120 epochs - improves robustness","timestamp":1780838610708,"segment":0,"confidence":2.9999999999999996,"asi":{"hypothesis":"Denoising VAE (input noise std=0.05) improves robustness and ensemble quality"}}
{"run":8,"commit":"133badc","metric":0.44,"metrics":{"val_recon_mse":0.44,"val_diversity":0.71,"final_val_loss":0.033,"elapsed_s":1.41},"status":"keep","description":"200 epochs with denoising (noise_std=0.05) - further improvement as model converges","timestamp":1780838626365,"segment":0,"confidence":3.010344827586207,"asi":{"hypothesis":"More training epochs further improve reconstruction on held-out proteins"}}
{"run":9,"commit":"9d960fa","metric":0.36,"metrics":{"val_recon_mse":0.36,"val_diversity":0.62,"final_val_loss":0.025,"elapsed_s":2.53},"status":"keep","description":"400 epochs - still improving. Combined score 0.36","timestamp":1780838635805,"segment":0,"confidence":5.092485549132948,"asi":{"hypothesis":"400 epochs continue to improve, training_loss=0.021 suggesting room for more epochs"}}
{"run":10,"commit":"f027556","metric":0.26,"metrics":{"val_recon_mse":0.26,"val_diversity":0.47,"final_val_loss":0.018,"elapsed_s":4.83},"status":"keep","description":"800 epochs - still improving. Combined score 0.26","timestamp":1780838648002,"segment":0,"confidence":8.211981566820278,"asi":{"hypothesis":"800 epochs with denoising continues to improve. Training loss at 0.015 suggests more room."}}
{"run":11,"commit":"f027556","metric":0.4,"metrics":{"val_recon_mse":0.4,"val_diversity":0.55,"final_val_loss":0.024,"elapsed_s":4.88},"status":"discard","description":"Cosine annealing LR schedule at 800 epochs - worse than constant LR","timestamp":1780838676250,"segment":0,"confidence":20.250000000000004,"asi":{"hypothesis":"Cosine annealing LR helps convergence","result":"Worse than constant LR - cosine reduces LR too fast for this small dataset"}}
{"run":12,"commit":"e4f146b","metric":0.23,"metrics":{"val_recon_mse":0.23,"val_diversity":0.36,"final_val_loss":0.015,"elapsed_s":8.6},"status":"keep","description":"1500 epochs - combined score 0.23, still slowly improving","timestamp":1780838693012,"segment":0,"confidence":23.220779220779217,"asi":{"hypothesis":"More epochs continue to improve, gap between train(0.012) and val(0.015) is small - not overfitting"}}
{"run":13,"commit":"e4f146b","metric":0.31,"metrics":{"val_recon_mse":0.31,"val_diversity":0.44,"final_val_loss":0.019,"elapsed_s":6.61},"status":"discard","description":"3-layer model at 800 epochs - worse than 2-layer (overfitting on small dataset)","timestamp":1780838743251,"segment":0,"confidence":29.799999999999994,"asi":{"hypothesis":"Deeper model (3 layers) improves learning","result":"Worse - too much capacity for small dataset","next_action":"Try 3-layer with dropout"}}
{"run":14,"commit":"6f9ebe3","metric":0.18,"metrics":{"val_recon_mse":0.18,"val_diversity":0.35,"final_val_loss":0.014,"elapsed_s":17.14},"status":"keep","description":"3000 epochs - pushing limits. Combined score 0.18, nearing convergence","timestamp":1780838772579,"segment":0,"confidence":35.254901960784316,"asi":{"hypothesis":"3000 epochs approaches convergence. Train 0.011, val 0.014, gap=0.003"}}
{"run":15,"commit":"6f9ebe3","metric":0.32,"metrics":{"val_recon_mse":0.32,"val_diversity":0.57,"final_val_loss":0.014,"elapsed_s":4.8},"status":"discard","description":"Huber loss (smooth L1) - worse MSE evaluation than MSE-trained model","timestamp":1780838789857,"segment":0,"confidence":42.80952380952381,"asi":{"hypothesis":"Huber loss is more robust to outliers","result":"Huber loss trains differently - eval uses MSE, creating mismatch","next_action":"Revert to MSE loss"}}
{"run":16,"commit":"88c1e06","metric":0.19,"metrics":{"val_recon_mse":0.19,"val_diversity":1.13,"final_val_loss":0.016,"elapsed_s":6.04},"status":"keep","description":"Temperature=2.0 sampling - 3x more diversity while maintaining reconstruction quality","timestamp":1780838868855,"segment":0,"confidence":42.8095238095238,"asi":{"hypothesis":"Temperature scaling at inference time increases ensemble diversity","diversity_boost":"3.2x vs temp=1.0"}}
{"run":17,"commit":"5a847c7","metric":0.19,"metrics":{"val_recon_mse":0.19,"val_diversity":0.74,"final_val_loss":0.014,"elapsed_s":8.97},"status":"keep","description":"Best config: PerResidueVAE(latent=16,hidden=128) + denoising(noise=0.05) + temp=2.0 + 1500 epochs","timestamp":1780838965141,"segment":0,"confidence":42.8095238095238,"asi":{"hypothesis":"Final best config consolidating all learnings","summary":"98% improvement over baseline. Key: per-residue VAE, denoising, near-zero KL, temp=2.0"}}
{"run":18,"commit":"5a847c7","metric":0.46,"metrics":{"val_recon_mse":0.46,"val_diversity":0.75,"final_val_loss":0.021,"elapsed_s":12.23},"status":"discard","description":"Sinusoidal positional encoding - worse than linear on this small dataset (too many params)","timestamp":1780839038461,"segment":0,"confidence":42.8095238095238,"asi":{"hypothesis":"Sinusoidal positional encoding provides richer position information","result":"No improvement - too many new parameters for tiny dataset","next_action":"Try adding more diverse PDB data to reduce stochasticity"}}
{"run":19,"commit":"1452817","metric":0.28,"metrics":{"val_recon_mse":0.28,"val_diversity":0.72,"final_val_loss":0.016,"elapsed_s":13.75},"status":"keep","description":"Expanded benchmark to 14 PDBs (10 train, 4 val). Best config, 1000 epochs.","timestamp":1780839109728,"segment":0,"confidence":52.88235294117647,"asi":{"hypothesis":"More training data improves generalization","note":"Evaluated on 4 held-out vs 2 previously"}}
{"run":20,"commit":"9b7d56d","metric":0.2,"metrics":{"val_recon_mse":0.2,"val_diversity":1.06,"final_val_loss":0.016,"elapsed_s":26.34},"status":"keep","description":"Larger model (latent=24, hidden=192) + 14 PDB dataset - better capacity with more data","timestamp":1780839176830,"segment":0,"confidence":49.94444444444444,"asi":{"hypothesis":"Larger model benefits from expanded dataset","recon_improvement":"-29% from 0.28 to 0.20"}}
{"run":21,"commit":"9b7d56d","metric":0.28,"metrics":{"val_recon_mse":0.28,"val_diversity":1.19,"final_val_loss":0.018,"elapsed_s":27.22},"status":"discard","description":"AdamW weight_decay=1e-5 - higher diversity but worse combined than plain Adam","timestamp":1780839352535,"segment":0,"confidence":56.18750000000001,"asi":{"hypothesis":"AdamW with weight_decay improves regularization","result":"Higher diversity(1.19) but worse recon(0.28), combined(0.28)","next_action":"Revert to Adam"}}
{"run":22,"commit":"72f4bc5","metric":0.21,"metrics":{"val_recon_mse":0.21,"val_diversity":1.15,"final_val_loss":0.017,"elapsed_s":27.01},"status":"keep","description":"Best config reproduced: latent=24,hidden=192,1500ep,best=0.21 combined with 1.15 diversity","timestamp":1780839456640,"segment":0,"confidence":66.59259259259262,"asi":{"hypothesis":"Consolidated best result. combined=0.21, diversity=1.15 on 14-PDB benchmark"}}
{"run":23,"commit":"72f4bc5","metric":0.24,"metrics":{"val_recon_mse":0.24,"val_diversity":1,"final_val_loss":0.017,"elapsed_s":31.93},"status":"discard","description":"Gradient clipping norm=5.0 - no improvement over no clipping","timestamp":1780839595119,"segment":0,"confidence":74.91666666666667,"asi":{"hypothesis":"Gradient clipping stabilizes training","result":"No improvement - simple 2-layer MLP doesn't need clipping","next_action":"Try noise annealing - curriculum learning for denoising"}}
{"run":24,"commit":"72f4bc5","metric":0.3,"metrics":{"val_recon_mse":0.3,"val_diversity":0.71,"final_val_loss":0.018,"elapsed_s":25.88},"status":"discard","description":"Noise annealing 0.10->0 over 500 epochs - no benefit over constant noise","timestamp":1780839699582,"segment":0,"confidence":74.91666666666667,"asi":{"hypothesis":"Noise annealing helps curriculum learning","result":"No improvement over constant noise_std=0.05","next_action":"Try longer training (3000 epochs) with best config"}}
{"run":25,"commit":"72f4bc5","metric":0.26,"metrics":{"val_recon_mse":0.26,"val_diversity":0.7,"final_val_loss":0.017,"elapsed_s":52.09},"status":"discard","description":"3000 epochs - no further improvement, model converged at ~1500","timestamp":1780839763262,"segment":0,"confidence":81.72727272727273,"asi":{"hypothesis":"More epochs improve convergence","result":"Model converges at ~1500 epochs on 14-PDB dataset","next_action":"Try LayerNorm instead of BatchNorm for small-batch stability"}}
{"run":26,"commit":"5fc24dd","metric":0.12,"metrics":{"val_recon_mse":0.13,"val_diversity":0.8,"final_val_loss":0.014,"elapsed_s":22.21},"status":"keep","description":"LayerNorm > BatchNorm: combined=0.12 with recon=0.13, diversity=0.80 - 40% improvement!","timestamp":1780839799926,"segment":0,"confidence":82.2727272727273,"asi":{"hypothesis":"LayerNorm is better than BatchNorm for single-protein batches","recon_improvement":"-40% from 0.21 to 0.12","note":"LayerNorm normalizes across features (consistent) vs BatchNorm across residues (variable)"}}
{"run":27,"commit":"e7a553d","metric":0.086,"metrics":{"val_recon_mse":0.087,"val_diversity":0.69,"final_val_loss":0.012,"elapsed_s":44.44},"status":"keep","description":"LayerNorm + 3000 epochs: combined=0.086, recon=0.087 - still improving!","timestamp":1780839854019,"segment":0,"confidence":82.58181818181819,"asi":{"hypothesis":"LayerNorm enables longer, more stable training","recon_improvement":"-33% from 0.13 to 0.087"}}
{"run":28,"commit":"e59feaa","metric":0.077,"metrics":{"val_recon_mse":0.078,"val_diversity":0.7,"final_val_loss":0.012,"elapsed_s":88.4},"status":"keep","description":"LayerNorm + 6000 epochs: combined=0.077, still slowly improving (nearing convergence)","timestamp":1780839952644,"segment":0,"confidence":86.6,"asi":{"hypothesis":"More epochs with LayerNorm keep improving","train_val_gap":"0.0113/0.0119 - minimal overfitting"}}
{"run":29,"commit":"e59feaa","metric":0.1,"metrics":{"val_recon_mse":0.1,"val_diversity":0.71,"final_val_loss":0.012,"elapsed_s":144.72},"status":"discard","description":"10000 epochs - slightly worse than 6000 (stochastic variation or early overfitting)","timestamp":1780840106689,"segment":0,"confidence":90.92999999999996,"asi":{"hypothesis":"Extreme long training converges better","result":"10000 slightly worse than 6000 - 6000 is the sweet spot","next_action":"Finalize with best config (6000 epochs)"}}
{"run":30,"commit":"e59feaa","metric":0.091,"metrics":{"val_recon_mse":0.092,"val_diversity":0.71,"final_val_loss":0.012,"elapsed_s":46.19},"status":"discard","description":"Rotation data augmentation - no improvement, similar to no-rotation baseline","timestamp":1780840232664,"segment":0,"confidence":82.66363636363636,"asi":{"hypothesis":"Random rotation augmentation improves generalization","result":"No clear improvement - per-residue processing already learns rotation-invariant features","next_action":"Try longer training with rotation or different approach"}}
